name	commit	date	description	fp_bps_250ms	fp_bps_500ms	fp_bps_1000ms	best_val_fp_bps_250ms	best_val_fp_bps_500ms	best_val_fp_bps_1000ms	best_test_fp_bps_250ms	best_test_fp_bps_500ms	best_test_fp_bps_1000ms	best_ckpt_250ms	best_ckpt_500ms	best_ckpt_1000ms	gpu_memory_gb	train_time_hours	notes
baseline_v2	e5dea0a	2026-03-11	NeuroHorizon v2 baseline (POYO+ encoder + AR decoder; no prediction feedback)	0.2115	0.1744	0.1317	-	-	-	-	-	-	-	-	-	-	-	plan.md 1.3.4 results; obs=500ms; cont sampling; 10 sessions; 300 epochs
benchmark_ndt2	23469ca	2026-03-12	NDT2 benchmark (MAE encoder-decoder)	0.1691	0.1502	0.1079	-	-	-	-	-	-	-	-	-	-	-	4.8M params
benchmark_neuroformer	23469ca	2026-03-12	Neuroformer benchmark (GPT-style decoder)	0.1856	0.1583	0.1210	-	-	-	-	-	-	-	-	-	-	-	4.9M params
benchmark_ibl_mtm	23469ca	2026-03-12	IBL-MtM benchmark (causal encoder NDT1)	0.1749	0.1531	0.1001	-	-	-	-	-	-	-	-	-	-	-	10.7M params
20260312_prediction_memory_decoder	4803fe8	2026-03-20	structured prediction memory decoder	0.1510	0.0200	-0.2192	0.2974	0.2840	0.2752	0.2943	0.2791	0.2753	epoch=129-step=17290.ckpt	epoch=189-step=18810.ckpt	epoch=169-step=22100.ckpt	-	-	obs=500ms; cont sampling; 10 sessions; 300 epochs; results.tsv stores rollout-valid fp-bps plus best-ckpt teacher-forced valid/test fp-bps
20260313_local_prediction_memory	4803fe8	2026-03-20	local prediction memory decoder	0.1679	0.0316	-0.1749	0.2833	0.2838	0.2736	0.2857	0.2750	0.2729	epoch=229-step=30590.ckpt	epoch=189-step=18810.ckpt	epoch=239-step=31200.ckpt	-	-	obs=500ms; cont sampling; 10 sessions; 300 epochs; results.tsv stores rollout-valid fp-bps plus best-ckpt teacher-forced valid/test fp-bps
20260313_prediction_memory_alignment	4803fe8	2026-03-20	prediction memory alignment training	0.1904	0.1623	0.1120	0.2690	0.2799	0.2762	0.2747	0.2729	0.2773	epoch=229-step=30590.ckpt	epoch=249-step=24750.ckpt	epoch=239-step=15600.ckpt	-	-	obs=500ms; cont sampling; 10 sessions; 300 epochs; results.tsv stores rollout-valid fp-bps plus best-ckpt teacher-forced valid/test fp-bps
20260313_prediction_memory_alignment_tuning	4803fe8	2026-03-20	prediction memory alignment tuning	0.1949	0.1635	0.1264	0.2636	0.2718	0.2815	0.2667	0.2655	0.2820	epoch=229-step=30590.ckpt	epoch=249-step=24750.ckpt	epoch=239-step=15600.ckpt	-	-	obs=500ms; cont sampling; 10 sessions; 300 epochs; results.tsv stores rollout-valid fp-bps plus best-ckpt teacher-forced valid/test fp-bps
